{
    "$schema": "http://json-schema.org/draft-07/schema#",
    "type": "object",
    "description": "Root object for the lesson.json data structure. All fields inside are optional, but there can't be other fields than the ones specified here.",
    "additionalProperties": false,
    "properties": {
      "lesson_date": {
        "type": "string",
        "description": "The date of the lesson (e.g., '19-02-2026'). Stored as a string."
      },
      "due_date": {
        "type": "string",
        "description": "The due date for the lesson's assignment. Stored as a string."
      },
      "num_hours": {
        "type": "number",
        "description": "The duration of the lesson in hours. Can be an integer (2) or float (2.5)."
      },
      "external_links": {
        "type": "array",
        "description": "A list of external resources and videos. Can be completely omitted or empty.",
        "items": {
          "type": "object",
          "description": "Each item in the array must be an object representing a link.",
          "additionalProperties": false,
          "properties": {
            "url": {
              "type": "string",
              "description": "The hyperlink to the resource."
            },
            "title": {
              "type": "string",
              "description": "The text title describing the link."
            }
          }
        }
      }
    }
  }