{
    "lesson_date": "19-02-2026",
    "due_date": "26-02-2026",
    "num_hours": 2,
    "external_links": [
      {
        "url": "https://www.youtube.com/watch?v=p23TXdR1tLs&list=PLejElsCmvhTAgmger39xY3hm3AVZTxD3A",
        "title": "קורס מעגל - גאומטריה י - עובד לב ארי- מהבסיס - 63 סרטונים"
      }
    ]
  }
  